{
  "$ref": "#/definitions/projects",
  "definitions": {
    "projects": {
      "type": "object",
      "properties": {
        "date": {
          "type": "string"
        },
        "title": {
          "type": "string"
        },
        "tags": {
          "type": "array",
          "items": {
            "type": "string"
          }
        },
        "image": {
          "type": "string"
        },
        "description": {
          "type": "string"
        },
        "listenOn": {
          "type": "array",
          "items": {
            "type": "object",
            "properties": {
              "name": {
                "type": "string"
              },
              "url": {
                "type": "string"
              }
            },
            "required": [
              "name",
              "url"
            ],
            "additionalProperties": false
          }
        },
        "topics": {
          "type": "array",
          "items": {
            "type": "string"
          }
        },
        "sponsors": {
          "type": "array",
          "items": {
            "type": "object",
            "properties": {
              "name": {
                "type": "string"
              },
              "description": {
                "type": "string"
              }
            },
            "required": [
              "name",
              "description"
            ],
            "additionalProperties": false
          }
        },
        "links": {
          "type": "array",
          "items": {
            "type": "object",
            "properties": {
              "label": {
                "type": "string"
              },
              "url": {
                "type": "string"
              }
            },
            "required": [
              "label",
              "url"
            ],
            "additionalProperties": false
          }
        },
        "transcript": {
          "type": "array",
          "items": {
            "type": "object",
            "properties": {
              "speaker": {
                "type": "string"
              },
              "text": {
                "type": "string"
              }
            },
            "required": [
              "speaker",
              "text"
            ],
            "additionalProperties": false
          }
        },
        "$schema": {
          "type": "string"
        }
      },
      "required": [
        "date",
        "title",
        "tags",
        "image",
        "description",
        "listenOn",
        "topics",
        "sponsors",
        "links",
        "transcript"
      ],
      "additionalProperties": false
    }
  },
  "$schema": "http://json-schema.org/draft-07/schema#"
}